14:45:39.734252 IP localhost.57349 > localhost.56073: Flags [S], seq 3098230820, win 65535, options [mss 16344,nop,wscale 6,nop,nop,TS val 3083638640 ecr 0,sackOK,eol], length 0
E..@..@.@..............	..@$.........4....?........
...p........
14:45:39.734269 IP localhost.57349 > localhost.56073: Flags [S], seq 3098230820, win 65535, options [mss 16344,nop,wscale 6,nop,nop,TS val 3083638640 ecr 0,sackOK,eol], length 0
E..@..@.@..............	..@$.........4....?........
...p........
14:45:39.734372 IP localhost.56073 > localhost.57349: Flags [S.], seq 4156368671, ack 3098230821, win 65535, options [mss 16344,nop,wscale 6,nop,nop,TS val 3148549865 ecr 3083638640,sackOK,eol], length 0
E..@..@.@............	....'...@%.....4....?........
.......p....
14:45:39.734379 IP localhost.56073 > localhost.57349: Flags [S.], seq 4156368671, ack 3098230821, win 65535, options [mss 16344,nop,wscale 6,nop,nop,TS val 3148549865 ecr 3083638640,sackOK,eol], length 0
E..@..@.@............	....'...@%.....4....?........
.......p....
14:45:39.734397 IP localhost.57349 > localhost.56073: Flags [.], ack 1, win 6379, options [nop,nop,TS val 3083638640 ecr 3148549865], length 0
E..4..@.@..............	..@%..' .....(.....
...p....
14:45:39.734400 IP localhost.57349 > localhost.56073: Flags [.], ack 1, win 6379, options [nop,nop,TS val 3083638640 ecr 3148549865], length 0
E..4..@.@..............	..@%..' .....(.....
...p....
14:45:39.734412 IP localhost.56073 > localhost.57349: Flags [.], ack 1, win 6379, options [nop,nop,TS val 3148549865 ecr 3083638640], length 0
E..4..@.@............	....' ..@%.....(.....
.......p
14:45:39.734416 IP localhost.56073 > localhost.57349: Flags [.], ack 1, win 6379, options [nop,nop,TS val 3148549865 ecr 3083638640], length 0
E..4..@.@............	....' ..@%.....(.....
.......p
14:45:39.734478 IP localhost.57349 > localhost.56073: Flags [P.], seq 1:135, ack 1, win 6379, options [nop,nop,TS val 3083638640 ecr 3148549865], length 134
E.....@.@..............	..@%..' ...........
...p....GET /health HTTP/1.1
Host: 127.0.0.1:56073
User-Agent: Go-http-client/1.1
Content-Type: application/json
Accept-Encoding: gzip


14:45:39.734493 IP localhost.57349 > localhost.56073: Flags [P.], seq 1:135, ack 1, win 6379, options [nop,nop,TS val 3083638640 ecr 3148549865], length 134
E.....@.@..............	..@%..' ...........
...p....GET /health HTTP/1.1
Host: 127.0.0.1:56073
User-Agent: Go-http-client/1.1
Content-Type: application/json
Accept-Encoding: gzip


14:45:39.734503 IP localhost.56073 > localhost.57349: Flags [.], ack 135, win 6377, options [nop,nop,TS val 3148549865 ecr 3083638640], length 0
E..4..@.@............	....' ..@......(.....
.......p
14:45:39.734506 IP localhost.56073 > localhost.57349: Flags [.], ack 135, win 6377, options [nop,nop,TS val 3148549865 ecr 3083638640], length 0
E..4..@.@............	....' ..@......(.....
.......p
14:45:39.737918 IP localhost.56073 > localhost.57349: Flags [P.], seq 1:121, ack 135, win 6377, options [nop,nop,TS val 3148549868 ecr 3083638640], length 120
E.....@.@............	....' ..@............
.......pHTTP/1.1 200 OK
Content-Length: 51
Content-Type: application/json
Keep-Alive: timeout=5, max=5
Server: llama.cpp


14:45:39.737939 IP localhost.56073 > localhost.57349: Flags [P.], seq 1:121, ack 135, win 6377, options [nop,nop,TS val 3148549868 ecr 3083638640], length 120
E.....@.@............	....' ..@............
.......pHTTP/1.1 200 OK
Content-Length: 51
Content-Type: application/json
Keep-Alive: timeout=5, max=5
Server: llama.cpp


14:45:39.737959 IP localhost.57349 > localhost.56073: Flags [.], ack 121, win 6377, options [nop,nop,TS val 3083638643 ecr 3148549868], length 0
E..4..@.@..............	..@...'......(.....
...s....
14:45:39.737970 IP localhost.57349 > localhost.56073: Flags [.], ack 121, win 6377, options [nop,nop,TS val 3083638643 ecr 3148549868], length 0
E..4..@.@..............	..@...'......(.....
...s....
14:45:39.737981 IP localhost.56073 > localhost.57349: Flags [P.], seq 121:172, ack 135, win 6377, options [nop,nop,TS val 3148549868 ecr 3083638643], length 51
E..g..@.@............	....'...@......[.....
.......s{"slots_idle":2,"slots_processing":0,"status":"ok"}
14:45:39.737984 IP localhost.56073 > localhost.57349: Flags [P.], seq 121:172, ack 135, win 6377, options [nop,nop,TS val 3148549868 ecr 3083638643], length 51
E..g..@.@............	....'...@......[.....
.......s{"slots_idle":2,"slots_processing":0,"status":"ok"}
14:45:39.737989 IP localhost.57349 > localhost.56073: Flags [.], ack 172, win 6377, options [nop,nop,TS val 3083638643 ecr 3148549868], length 0
E..4..@.@..............	..@...'......(.....
...s....
14:45:39.738000 IP localhost.57349 > localhost.56073: Flags [.], ack 172, win 6377, options [nop,nop,TS val 3083638643 ecr 3148549868], length 0
E..4..@.@..............	..@...'......(.....
...s....
14:45:44.745743 IP localhost.56073 > localhost.57349: Flags [F.], seq 172, ack 135, win 6377, options [nop,nop,TS val 3148554876 ecr 3083638643], length 0
E..4..@.@............	....'...@......(.....
.."|...s
14:45:44.745777 IP localhost.56073 > localhost.57349: Flags [F.], seq 172, ack 135, win 6377, options [nop,nop,TS val 3148554876 ecr 3083638643], length 0
E..4..@.@............	....'...@......(.....
.."|...s
14:45:44.745835 IP localhost.57349 > localhost.56073: Flags [.], ack 173, win 6377, options [nop,nop,TS val 3083643651 ecr 3148554876], length 0
E..4..@.@..............	..@...'......(.....
......"|
14:45:44.745844 IP localhost.57349 > localhost.56073: Flags [.], ack 173, win 6377, options [nop,nop,TS val 3083643651 ecr 3148554876], length 0
E..4..@.@..............	..@...'......(.....
......"|
14:45:44.745937 IP localhost.57349 > localhost.56073: Flags [F.], seq 135, ack 173, win 6377, options [nop,nop,TS val 3083643651 ecr 3148554876], length 0
E..4..@.@..............	..@...'......(.....
......"|
14:45:44.745949 IP localhost.57349 > localhost.56073: Flags [F.], seq 135, ack 173, win 6377, options [nop,nop,TS val 3083643651 ecr 3148554876], length 0
E..4..@.@..............	..@...'......(.....
......"|
14:45:44.746004 IP localhost.56073 > localhost.57349: Flags [.], ack 136, win 6377, options [nop,nop,TS val 3148554876 ecr 3083643651], length 0
E..4..@.@............	....'...@......(.....
.."|....
14:45:44.746009 IP localhost.56073 > localhost.57349: Flags [.], ack 136, win 6377, options [nop,nop,TS val 3148554876 ecr 3083643651], length 0
E..4..@.@............	....'...@......(.....
.."|....
14:45:59.579427 IP localhost.57371 > localhost.56073: Flags [S], seq 738840921, win 65535, options [mss 16344,nop,wscale 6,nop,nop,TS val 1270355064 ecr 0,sackOK,eol], length 0
E..@..@.@..............	,	.Y.........4....?........
K..x........
14:45:59.579455 IP localhost.57371 > localhost.56073: Flags [S], seq 738840921, win 65535, options [mss 16344,nop,wscale 6,nop,nop,TS val 1270355064 ecr 0,sackOK,eol], length 0
E..@..@.@..............	,	.Y.........4....?........
K..x........
14:45:59.579658 IP localhost.56073 > localhost.57371: Flags [S.], seq 3529823348, ack 738840922, win 65535, options [mss 16344,nop,wscale 6,nop,nop,TS val 3601928315 ecr 1270355064,sackOK,eol], length 0
E..@..@.@............	...d.t,	.Z.....4....?........
...{K..x....
14:45:59.579670 IP localhost.56073 > localhost.57371: Flags [S.], seq 3529823348, ack 738840922, win 65535, options [mss 16344,nop,wscale 6,nop,nop,TS val 3601928315 ecr 1270355064,sackOK,eol], length 0
E..@..@.@............	...d.t,	.Z.....4....?........
...{K..x....
14:45:59.579704 IP localhost.57371 > localhost.56073: Flags [.], ack 1, win 6379, options [nop,nop,TS val 1270355064 ecr 3601928315], length 0
E..4..@.@..............	,	.Z.d.u.....(.....
K..x...{
14:45:59.579707 IP localhost.57371 > localhost.56073: Flags [.], ack 1, win 6379, options [nop,nop,TS val 1270355064 ecr 3601928315], length 0
E..4..@.@..............	,	.Z.d.u.....(.....
K..x...{
14:45:59.579735 IP localhost.56073 > localhost.57371: Flags [.], ack 1, win 6379, options [nop,nop,TS val 3601928315 ecr 1270355064], length 0
E..4..@.@............	...d.u,	.Z.....(.....
...{K..x
14:45:59.579741 IP localhost.56073 > localhost.57371: Flags [.], ack 1, win 6379, options [nop,nop,TS val 3601928315 ecr 1270355064], length 0
E..4..@.@............	...d.u,	.Z.....(.....
...{K..x
14:45:59.579807 IP localhost.57371 > localhost.56073: Flags [P.], seq 1:135, ack 1, win 6379, options [nop,nop,TS val 1270355064 ecr 3601928315], length 134
E.....@.@..............	,	.Z.d.u...........
K..x...{GET /health HTTP/1.1
Host: 127.0.0.1:56073
User-Agent: Go-http-client/1.1
Content-Type: application/json
Accept-Encoding: gzip


14:45:59.579825 IP localhost.57371 > localhost.56073: Flags [P.], seq 1:135, ack 1, win 6379, options [nop,nop,TS val 1270355064 ecr 3601928315], length 134
E.....@.@..............	,	.Z.d.u...........
K..x...{GET /health HTTP/1.1
Host: 127.0.0.1:56073
User-Agent: Go-http-client/1.1
Content-Type: application/json
Accept-Encoding: gzip


14:45:59.579840 IP localhost.56073 > localhost.57371: Flags [.], ack 135, win 6377, options [nop,nop,TS val 3601928315 ecr 1270355064], length 0
E..4..@.@............	...d.u,	.......(.....
...{K..x
14:45:59.579849 IP localhost.56073 > localhost.57371: Flags [.], ack 135, win 6377, options [nop,nop,TS val 3601928315 ecr 1270355064], length 0
E..4..@.@............	...d.u,	.......(.....
...{K..x
14:45:59.580425 IP localhost.56073 > localhost.57371: Flags [P.], seq 1:121, ack 135, win 6377, options [nop,nop,TS val 3601928316 ecr 1270355064], length 120
E.....@.@............	...d.u,	.............
...|K..xHTTP/1.1 200 OK
Content-Length: 51
Content-Type: application/json
Keep-Alive: timeout=5, max=5
Server: llama.cpp


14:45:59.580443 IP localhost.56073 > localhost.57371: Flags [P.], seq 1:121, ack 135, win 6377, options [nop,nop,TS val 3601928316 ecr 1270355064], length 120
E.....@.@............	...d.u,	.............
...|K..xHTTP/1.1 200 OK
Content-Length: 51
Content-Type: application/json
Keep-Alive: timeout=5, max=5
Server: llama.cpp


14:45:59.580453 IP localhost.57371 > localhost.56073: Flags [.], ack 121, win 6377, options [nop,nop,TS val 1270355065 ecr 3601928316], length 0
E..4..@.@..............	,	...d.......(.....
K..y...|
14:45:59.580462 IP localhost.57371 > localhost.56073: Flags [.], ack 121, win 6377, options [nop,nop,TS val 1270355065 ecr 3601928316], length 0
E..4..@.@..............	,	...d.......(.....
K..y...|
14:45:59.580468 IP localhost.56073 > localhost.57371: Flags [P.], seq 121:172, ack 135, win 6377, options [nop,nop,TS val 3601928316 ecr 1270355065], length 51
E..g..@.@............	...d..,	.......[.....
...|K..y{"slots_idle":2,"slots_processing":0,"status":"ok"}
14:45:59.580471 IP localhost.56073 > localhost.57371: Flags [P.], seq 121:172, ack 135, win 6377, options [nop,nop,TS val 3601928316 ecr 1270355065], length 51
E..g..@.@............	...d..,	.......[.....
...|K..y{"slots_idle":2,"slots_processing":0,"status":"ok"}
14:45:59.580478 IP localhost.57371 > localhost.56073: Flags [.], ack 172, win 6377, options [nop,nop,TS val 1270355065 ecr 3601928316], length 0
E..4..@.@..............	,	...d. .....(.....
K..y...|
14:45:59.580481 IP localhost.57371 > localhost.56073: Flags [.], ack 172, win 6377, options [nop,nop,TS val 1270355065 ecr 3601928316], length 0
E..4..@.@..............	,	...d. .....(.....
K..y...|
14:45:59.581617 IP localhost.57371 > localhost.56073: Flags [P.], seq 135:269, ack 172, win 6377, options [nop,nop,TS val 1270355066 ecr 3601928316], length 134
E.....@.@..............	,	...d. ...........
K..z...|GET /health HTTP/1.1
Host: 127.0.0.1:56073
User-Agent: Go-http-client/1.1
Content-Type: application/json
Accept-Encoding: gzip


14:45:59.581636 IP localhost.57371 > localhost.56073: Flags [P.], seq 135:269, ack 172, win 6377, options [nop,nop,TS val 1270355066 ecr 3601928316], length 134
E.....@.@..............	,	...d. ...........
K..z...|GET /health HTTP/1.1
Host: 127.0.0.1:56073
User-Agent: Go-http-client/1.1
Content-Type: application/json
Accept-Encoding: gzip


14:45:59.581645 IP localhost.56073 > localhost.57371: Flags [.], ack 269, win 6375, options [nop,nop,TS val 3601928317 ecr 1270355066], length 0
E..4..@.@............	...d. ,	.f.....(.....
...}K..z
14:45:59.581655 IP localhost.56073 > localhost.57371: Flags [.], ack 269, win 6375, options [nop,nop,TS val 3601928317 ecr 1270355066], length 0
E..4..@.@............	...d. ,	.f.....(.....
...}K..z
14:45:59.581817 IP localhost.56073 > localhost.57371: Flags [P.], seq 172:292, ack 269, win 6375, options [nop,nop,TS val 3601928317 ecr 1270355066], length 120
E.....@.@............	...d. ,	.f...........
...}K..zHTTP/1.1 200 OK
Content-Length: 51
Content-Type: application/json
Keep-Alive: timeout=5, max=5
Server: llama.cpp


14:45:59.581837 IP localhost.56073 > localhost.57371: Flags [P.], seq 172:292, ack 269, win 6375, options [nop,nop,TS val 3601928317 ecr 1270355066], length 120
E.....@.@............	...d. ,	.f...........
...}K..zHTTP/1.1 200 OK
Content-Length: 51
Content-Type: application/json
Keep-Alive: timeout=5, max=5
Server: llama.cpp


14:45:59.581846 IP localhost.57371 > localhost.56073: Flags [.], ack 292, win 6375, options [nop,nop,TS val 1270355066 ecr 3601928317], length 0
E..4..@.@..............	,	.f.d.......(.....
K..z...}
14:45:59.581855 IP localhost.57371 > localhost.56073: Flags [.], ack 292, win 6375, options [nop,nop,TS val 1270355066 ecr 3601928317], length 0
E..4..@.@..............	,	.f.d.......(.....
K..z...}
14:45:59.581860 IP localhost.56073 > localhost.57371: Flags [P.], seq 292:343, ack 269, win 6375, options [nop,nop,TS val 3601928317 ecr 1270355066], length 51
E..g..@.@............	...d..,	.f.....[.....
...}K..z{"slots_idle":2,"slots_processing":0,"status":"ok"}
14:45:59.581863 IP localhost.56073 > localhost.57371: Flags [P.], seq 292:343, ack 269, win 6375, options [nop,nop,TS val 3601928317 ecr 1270355066], length 51
E..g..@.@............	...d..,	.f.....[.....
...}K..z{"slots_idle":2,"slots_processing":0,"status":"ok"}
14:45:59.581870 IP localhost.57371 > localhost.56073: Flags [.], ack 343, win 6374, options [nop,nop,TS val 1270355066 ecr 3601928317], length 0
E..4..@.@..............	,	.f.d.......(.....
K..z...}
14:45:59.581873 IP localhost.57371 > localhost.56073: Flags [.], ack 343, win 6374, options [nop,nop,TS val 1270355066 ecr 3601928317], length 0
E..4..@.@..............	,	.f.d.......(.....
K..z...}
14:45:59.581955 IP localhost.57371 > localhost.56073: Flags [P.], seq 269:958, ack 343, win 6374, options [nop,nop,TS val 1270355066 ecr 3601928317], length 689
E.....@.@..............	,	.f.d.............
K..z...}POST /completion HTTP/1.1
Host: 127.0.0.1:56073
User-Agent: Go-http-client/1.1
Content-Length: 529
Content-Type: application/json
Accept-Encoding: gzip

{"cache_prompt":true,"frequency_penalty":0,"image_data":null,"main_gpu":0,"mirostat":0,"mirostat_eta":0.1,"mirostat_tau":5,"n_keep":24,"n_predict":40960,"penalize_nl":true,"presence_penalty":0,"prompt":"<|start_header_id|>user<|end_header_id|>\n\nwhatis override inhertiance<|eot_id|><|start_header_id|>assistant<|end_header_id|>\n\n","repeat_last_n":64,"repeat_penalty":1.1,"seed":-1,"stop":["<|start_header_id|>","<|end_header_id|>","<|eot_id|>"],"stream":true,"temperature":0.8,"tfs_z":1,"top_k":40,"top_p":0.9,"typical_p":1}

14:45:59.581974 IP localhost.57371 > localhost.56073: Flags [P.], seq 269:958, ack 343, win 6374, options [nop,nop,TS val 1270355066 ecr 3601928317], length 689
E.....@.@..............	,	.f.d.............
K..z...}POST /completion HTTP/1.1
Host: 127.0.0.1:56073
User-Agent: Go-http-client/1.1
Content-Length: 529
Content-Type: application/json
Accept-Encoding: gzip

{"cache_prompt":true,"frequency_penalty":0,"image_data":null,"main_gpu":0,"mirostat":0,"mirostat_eta":0.1,"mirostat_tau":5,"n_keep":24,"n_predict":40960,"penalize_nl":true,"presence_penalty":0,"prompt":"<|start_header_id|>user<|end_header_id|>\n\nwhatis override inhertiance<|eot_id|><|start_header_id|>assistant<|end_header_id|>\n\n","repeat_last_n":64,"repeat_penalty":1.1,"seed":-1,"stop":["<|start_header_id|>","<|end_header_id|>","<|eot_id|>"],"stream":true,"temperature":0.8,"tfs_z":1,"top_k":40,"top_p":0.9,"typical_p":1}

14:45:59.581982 IP localhost.56073 > localhost.57371: Flags [.], ack 958, win 6364, options [nop,nop,TS val 3601928317 ecr 1270355066], length 0
E..4..@.@............	...d..,	.......(.....
...}K..z
14:45:59.581992 IP localhost.56073 > localhost.57371: Flags [.], ack 958, win 6364, options [nop,nop,TS val 3601928317 ecr 1270355066], length 0
E..4..@.@............	...d..,	.......(.....
...}K..z
14:45:59.582413 IP localhost.56073 > localhost.57371: Flags [P.], seq 343:503, ack 958, win 6364, options [nop,nop,TS val 3601928317 ecr 1270355066], length 160
E.....@.@............	...d..,	.............
...}K..zHTTP/1.1 200 OK
Access-Control-Allow-Origin: 
Content-Type: text/event-stream
Keep-Alive: timeout=5, max=5
Server: llama.cpp
Transfer-Encoding: chunked


14:45:59.582430 IP localhost.56073 > localhost.57371: Flags [P.], seq 343:503, ack 958, win 6364, options [nop,nop,TS val 3601928317 ecr 1270355066], length 160
E.....@.@............	...d..,	.............
...}K..zHTTP/1.1 200 OK
Access-Control-Allow-Origin: 
Content-Type: text/event-stream
Keep-Alive: timeout=5, max=5
Server: llama.cpp
Transfer-Encoding: chunked


14:45:59.582438 IP localhost.57371 > localhost.56073: Flags [.], ack 503, win 6371, options [nop,nop,TS val 1270355066 ecr 3601928317], length 0
E..4..@.@..............	,	...d.k.....(.....
K..z...}
14:45:59.582448 IP localhost.57371 > localhost.56073: Flags [.], ack 503, win 6371, options [nop,nop,TS val 1270355066 ecr 3601928317], length 0
E..4..@.@..............	,	...d.k.....(.....
K..z...}
14:46:05.088117 IP localhost.56073 > localhost.57371: Flags [P.], seq 503:576, ack 958, win 6364, options [nop,nop,TS val 3601933824 ecr 1270355066], length 73
E..}..@.@............	...d.k,	.......q.....
..&.K..z43
data: {"content":"A","multimodal":false,"slot_id":0,"stop":false}



14:46:05.088140 IP localhost.56073 > localhost.57371: Flags [P.], seq 503:576, ack 958, win 6364, options [nop,nop,TS val 3601933824 ecr 1270355066], length 73
E..}..@.@............	...d.k,	.......q.....
..&.K..z43
data: {"content":"A","multimodal":false,"slot_id":0,"stop":false}



14:46:05.088167 IP localhost.57371 > localhost.56073: Flags [.], ack 576, win 6370, options [nop,nop,TS val 1270360573 ecr 3601933824], length 0
E..4..@.@..............	,	...d.......(.....
K.)...&.
14:46:05.088180 IP localhost.57371 > localhost.56073: Flags [.], ack 576, win 6370, options [nop,nop,TS val 1270360573 ecr 3601933824], length 0
E..4..@.@..............	,	...d.......(.....
K.)...&.
14:46:05.263630 IP localhost.56073 > localhost.57371: Flags [P.], seq 576:660, ack 958, win 6364, options [nop,nop,TS val 3601933999 ecr 1270360573], length 84
E.....@.@............	...d..,	.......|.....
..&.K.).4e
data: {"content":" fundamental","multimodal":false,"slot_id":0,"stop":false}



14:46:05.263652 IP localhost.56073 > localhost.57371: Flags [P.], seq 576:660, ack 958, win 6364, options [nop,nop,TS val 3601933999 ecr 1270360573], length 84
E.....@.@............	...d..,	.......|.....
..&.K.).4e
data: {"content":" fundamental","multimodal":false,"slot_id":0,"stop":false}



14:46:05.263676 IP localhost.57371 > localhost.56073: Flags [.], ack 660, win 6369, options [nop,nop,TS val 1270360748 ecr 3601933999], length 0
E..4..@.@..............	,	...d.......(.....
K.*...&.
14:46:05.263690 IP localhost.57371 > localhost.56073: Flags [.], ack 660, win 6369, options [nop,nop,TS val 1270360748 ecr 3601933999], length 0
E..4..@.@..............	,	...d.......(.....
K.*...&.
14:46:05.326153 IP localhost.56073 > localhost.57371: Flags [P.], seq 660:740, ack 958, win 6364, options [nop,nop,TS val 3601934062 ecr 1270360748], length 80
E.....@.@............	...d..,	.......x.....
..&.K.*.4a
data: {"content":" concept","multimodal":false,"slot_id":0,"stop":false}



14:46:05.326176 IP localhost.56073 > localhost.57371: Flags [P.], seq 660:740, ack 958, win 6364, options [nop,nop,TS val 3601934062 ecr 1270360748], length 80
E.....@.@............	...d..,	.......x.....
..&.K.*.4a
data: {"content":" concept","multimodal":false,"slot_id":0,"stop":false}



14:46:05.326204 IP localhost.57371 > localhost.56073: Flags [.], ack 740, win 6368, options [nop,nop,TS val 1270360811 ecr 3601934062], length 0
E..4..@.@..............	,	...d.X.....(.....
K.*...&.
14:46:05.326217 IP localhost.57371 > localhost.56073: Flags [.], ack 740, win 6368, options [nop,nop,TS val 1270360811 ecr 3601934062], length 0
E..4..@.@..............	,	...d.X.....(.....
K.*...&.
14:46:05.384811 IP localhost.56073 > localhost.57371: Flags [P.], seq 740:815, ack 958, win 6364, options [nop,nop,TS val 3601934120 ecr 1270360811], length 75
E.....@.@............	...d.X,	.......s.....
..'(K.*.45
data: {"content":" in","multimodal":false,"slot_id":0,"stop":false}



14:46:05.384825 IP localhost.56073 > localhost.57371: Flags [P.], seq 740:815, ack 958, win 6364, options [nop,nop,TS val 3601934120 ecr 1270360811], length 75
E.....@.@............	...d.X,	.......s.....
..'(K.*.45
data: {"content":" in","multimodal":false,"slot_id":0,"stop":false}



14:46:05.384842 IP localhost.57371 > localhost.56073: Flags [.], ack 815, win 6366, options [nop,nop,TS val 1270360869 ecr 3601934120], length 0
E..4..@.@..............	,	...d.......(.....
K.+%..'(
14:46:05.384850 IP localhost.57371 > localhost.56073: Flags [.], ack 815, win 6366, options [nop,nop,TS val 1270360869 ecr 3601934120], length 0
E..4..@.@..............	,	...d.......(.....
K.+%..'(
14:46:05.540236 IP localhost.56073 > localhost.57371: Flags [P.], seq 815:894, ack 958, win 6364, options [nop,nop,TS val 3601934276 ecr 1270360869], length 79
E.....@.@............	...d..,	.......w.....
..'.K.+%49
data: {"content":" object","multimodal":false,"slot_id":0,"stop":false}



14:46:05.540253 IP localhost.56073 > localhost.57371: Flags [P.], seq 815:894, ack 958, win 6364, options [nop,nop,TS val 3601934276 ecr 1270360869], length 79
E.....@.@............	...d..,	.......w.....
..'.K.+%49
data: {"content":" object","multimodal":false,"slot_id":0,"stop":false}



14:46:05.540283 IP localhost.57371 > localhost.56073: Flags [.], ack 894, win 6365, options [nop,nop,TS val 1270361025 ecr 3601934276], length 0
E..4..@.@..............	,	...d.......(.....
K.+...'.
14:46:05.540291 IP localhost.57371 > localhost.56073: Flags [.], ack 894, win 6365, options [nop,nop,TS val 1270361025 ecr 3601934276], length 0
E..4..@.@..............	,	...d.......(.....
K.+...'.
14:46:05.597468 IP localhost.56073 > localhost.57371: Flags [P.], seq 894:975, ack 958, win 6364, options [nop,nop,TS val 3601934333 ecr 1270361025], length 81
E.....@.@............	...d..,	.......y.....
..'.K.+.4b
data: {"content":"-oriented","multimodal":false,"slot_id":0,"stop":false}



14:46:05.597486 IP localhost.56073 > localhost.57371: Flags [P.], seq 894:975, ack 958, win 6364, options [nop,nop,TS val 3601934333 ecr 1270361025], length 81
E.....@.@............	...d..,	.......y.....
..'.K.+.4b
data: {"content":"-oriented","multimodal":false,"slot_id":0,"stop":false}



14:46:05.597518 IP localhost.57371 > localhost.56073: Flags [.], ack 975, win 6364, options [nop,nop,TS val 1270361082 ecr 3601934333], length 0
E..4..@.@..............	,	...d.C.....(.....
K.+...'.
14:46:05.597531 IP localhost.57371 > localhost.56073: Flags [.], ack 975, win 6364, options [nop,nop,TS val 1270361082 ecr 3601934333], length 0
E..4..@.@..............	,	...d.C.....(.....
K.+...'.
14:46:05.656483 IP localhost.56073 > localhost.57371: Flags [P.], seq 975:1059, ack 958, win 6364, options [nop,nop,TS val 3601934392 ecr 1270361082], length 84
E.....@.@............	...d.C,	.......|.....
..(8K.+.4e
data: {"content":" programming","multimodal":false,"slot_id":0,"stop":false}



14:46:05.656500 IP localhost.56073 > localhost.57371: Flags [P.], seq 975:1059, ack 958, win 6364, options [nop,nop,TS val 3601934392 ecr 1270361082], length 84
E.....@.@............	...d.C,	.......|.....
..(8K.+.4e
data: {"content":" programming","multimodal":false,"slot_id":0,"stop":false}



14:46:05.656521 IP localhost.57371 > localhost.56073: Flags [.], ack 1059, win 6363, options [nop,nop,TS val 1270361141 ecr 3601934392], length 0
E..4..@.@..............	,	...d.......(.....
K.,5..(8
14:46:05.656530 IP localhost.57371 > localhost.56073: Flags [.], ack 1059, win 6363, options [nop,nop,TS val 1270361141 ecr 3601934392], length 0
E..4..@.@..............	,	...d.......(.....
K.,5..(8
14:46:05.713225 IP localhost.56073 > localhost.57371: Flags [P.], seq 1059:1136, ack 958, win 6364, options [nop,nop,TS val 3601934449 ecr 1270361141], length 77
E.....@.@............	...d..,	.......u.....
..(qK.,547
data: {"content":"!\n\n","multimodal":false,"slot_id":0,"stop":false}



14:46:05.713245 IP localhost.56073 > localhost.57371: Flags [P.], seq 1059:1136, ack 958, win 6364, options [nop,nop,TS val 3601934449 ecr 1270361141], length 77
E.....@.@............	...d..,	.......u.....
..(qK.,547
data: {"content":"!\n\n","multimodal":false,"slot_id":0,"stop":false}



14:46:05.713270 IP localhost.57371 > localhost.56073: Flags [.], ack 1136, win 6361, options [nop,nop,TS val 1270361198 ecr 3601934449], length 0
E..4..@.@..............	,	...d.......(.....
K.,n..(q
14:46:05.713283 IP localhost.57371 > localhost.56073: Flags [.], ack 1136, win 6361, options [nop,nop,TS val 1270361198 ecr 3601934449], length 0
E..4..@.@..............	,	...d.......(.....
K.,n..(q
14:46:05.768771 IP localhost.56073 > localhost.57371: Flags [P.], seq 1136:1210, ack 958, win 6364, options [nop,nop,TS val 3601934504 ecr 1270361198], length 74
E..~..@.@............	...d..,	.......r.....
..(.K.,n44
data: {"content":"**","multimodal":false,"slot_id":0,"stop":false}



14:46:05.768793 IP localhost.56073 > localhost.57371: Flags [P.], seq 1136:1210, ack 958, win 6364, options [nop,nop,TS val 3601934504 ecr 1270361198], length 74
E..~..@.@............	...d..,	.......r.....
..(.K.,n44
data: {"content":"**","multimodal":false,"slot_id":0,"stop":false}



14:46:05.768821 IP localhost.57371 > localhost.56073: Flags [.], ack 1210, win 6360, options [nop,nop,TS val 1270361253 ecr 3601934504], length 0
E..4..@.@..............	,	...d.......(.....
K.,...(.
14:46:05.768834 IP localhost.57371 > localhost.56073: Flags [.], ack 1210, win 6360, options [nop,nop,TS val 1270361253 ecr 3601934504], length 0
E..4..@.@..............	,	...d.......(.....
K.,...(.
14:46:05.894508 IP localhost.56073 > localhost.57371: Flags [P.], seq 1210:1290, ack 958, win 6364, options [nop,nop,TS val 3601934630 ecr 1270361253], length 80
E.....@.@............	...d..,	.......x.....
..)&K.,.4a
data: {"content":"Override","multimodal":false,"slot_id":0,"stop":false}



14:46:05.894531 IP localhost.56073 > localhost.57371: Flags [P.], seq 1210:1290, ack 958, win 6364, options [nop,nop,TS val 3601934630 ecr 1270361253], length 80
E.....@.@............	...d..,	.......x.....
..)&K.,.4a
data: {"content":"Override","multimodal":false,"slot_id":0,"stop":false}



14:46:05.894558 IP localhost.57371 > localhost.56073: Flags [.], ack 1290, win 6359, options [nop,nop,TS val 1270361379 ecr 3601934630], length 0
E..4..@.@..............	,	...d.~.....(.....
K.-#..)&
14:46:05.894571 IP localhost.57371 > localhost.56073: Flags [.], ack 1290, win 6359, options [nop,nop,TS val 1270361379 ecr 3601934630], length 0
E..4..@.@..............	,	...d.~.....(.....
K.-#..)&
14:46:05.950794 IP localhost.56073 > localhost.57371: Flags [P.], seq 1290:1364, ack 958, win 6364, options [nop,nop,TS val 3601934686 ecr 1270361379], length 74
E..~..@.@............	...d.~,	.......r.....
..)^K.-#44
data: {"content":"**","multimodal":false,"slot_id":0,"stop":false}



14:46:05.950813 IP localhost.56073 > localhost.57371: Flags [P.], seq 1290:1364, ack 958, win 6364, options [nop,nop,TS val 3601934686 ecr 1270361379], length 74
E..~..@.@............	...d.~,	.......r.....
..)^K.-#44
data: {"content":"**","multimodal":false,"slot_id":0,"stop":false}



14:46:05.950850 IP localhost.57371 > localhost.56073: Flags [.], ack 1364, win 6358, options [nop,nop,TS val 1270361435 ecr 3601934686], length 0
E..4..@.@..............	,	...d.......(.....
K.-[..)^
14:46:05.950863 IP localhost.57371 > localhost.56073: Flags [.], ack 1364, win 6358, options [nop,nop,TS val 1270361435 ecr 3601934686], length 0
E..4..@.@..............	,	...d.......(.....
K.-[..)^
14:46:06.005955 IP localhost.56073 > localhost.57371: Flags [P.], seq 1364:1439, ack 958, win 6364, options [nop,nop,TS val 3601934742 ecr 1270361435], length 75
E.....@.@............	...d..,	.......s.....
..).K.-[45
data: {"content":" is","multimodal":false,"slot_id":0,"stop":false}



14:46:06.005977 IP localhost.56073 > localhost.57371: Flags [P.], seq 1364:1439, ack 958, win 6364, options [nop,nop,TS val 3601934742 ecr 1270361435], length 75
E.....@.@............	...d..,	.......s.....
..).K.-[45
data: {"content":" is","multimodal":false,"slot_id":0,"stop":false}



14:46:06.006021 IP localhost.57371 > localhost.56073: Flags [.], ack 1439, win 6357, options [nop,nop,TS val 1270361491 ecr 3601934742], length 0
E..4..@.@..............	,	...d.......(.....
K.-...).
14:46:06.006037 IP localhost.57371 > localhost.56073: Flags [.], ack 1439, win 6357, options [nop,nop,TS val 1270361491 ecr 3601934742], length 0
E..4..@.@..............	,	...d.......(.....
K.-...).
14:46:06.075292 IP localhost.56073 > localhost.57371: Flags [P.], seq 1439:1513, ack 958, win 6364, options [nop,nop,TS val 3601934811 ecr 1270361491], length 74
E..~..@.@............	...d..,	.......r.....
..).K.-.44
data: {"content":" a","multimodal":false,"slot_id":0,"stop":false}



14:46:06.075311 IP localhost.56073 > localhost.57371: Flags [P.], seq 1439:1513, ack 958, win 6364, options [nop,nop,TS val 3601934811 ecr 1270361491], length 74
E..~..@.@............	...d..,	.......r.....
..).K.-.44
data: {"content":" a","multimodal":false,"slot_id":0,"stop":false}



14:46:06.075410 IP localhost.57371 > localhost.56073: Flags [.], ack 1513, win 6356, options [nop,nop,TS val 1270361560 ecr 3601934811], length 0
E..4..@.@..............	,	...d.].....(.....
K.-...).
14:46:06.075423 IP localhost.57371 > localhost.56073: Flags [.], ack 1513, win 6356, options [nop,nop,TS val 1270361560 ecr 3601934811], length 0
E..4..@.@..............	,	...d.].....(.....
K.-...).
14:46:06.132373 IP localhost.56073 > localhost.57371: Flags [P.], seq 1513:1595, ack 958, win 6364, options [nop,nop,TS val 3601934868 ecr 1270361560], length 82
E.....@.@............	...d.],	.......z.....
..*.K.-.4c
data: {"content":" mechanism","multimodal":false,"slot_id":0,"stop":false}



14:46:06.132402 IP localhost.56073 > localhost.57371: Flags [P.], seq 1513:1595, ack 958, win 6364, options [nop,nop,TS val 3601934868 ecr 1270361560], length 82
E.....@.@............	...d.],	.......z.....
..*.K.-.4c
data: {"content":" mechanism","multimodal":false,"slot_id":0,"stop":false}



14:46:06.132474 IP localhost.57371 > localhost.56073: Flags [.], ack 1595, win 6354, options [nop,nop,TS val 1270361617 ecr 3601934868], length 0
E..4..@.@..............	,	...d.......(.....
K.....*.
14:46:06.132492 IP localhost.57371 > localhost.56073: Flags [.], ack 1595, win 6354, options [nop,nop,TS val 1270361617 ecr 3601934868], length 0
E..4..@.@..............	,	...d.......(.....
K.....*.
14:46:06.193917 IP localhost.56073 > localhost.57371: Flags [P.], seq 1595:1670, ack 958, win 6364, options [nop,nop,TS val 3601934929 ecr 1270361617], length 75
E.....@.@............	...d..,	.......s.....
..*QK...45
data: {"content":" in","multimodal":false,"slot_id":0,"stop":false}



14:46:06.193934 IP localhost.56073 > localhost.57371: Flags [P.], seq 1595:1670, ack 958, win 6364, options [nop,nop,TS val 3601934929 ecr 1270361617], length 75
E.....@.@............	...d..,	.......s.....
..*QK...45
data: {"content":" in","multimodal":false,"slot_id":0,"stop":false}



14:46:06.193973 IP localhost.57371 > localhost.56073: Flags [.], ack 1670, win 6353, options [nop,nop,TS val 1270361678 ecr 3601934929], length 0
E..4..@.@..............	,	...d.......(.....
K..N..*Q
14:46:06.193988 IP localhost.57371 > localhost.56073: Flags [.], ack 1670, win 6353, options [nop,nop,TS val 1270361678 ecr 3601934929], length 0
E..4..@.@..............	,	...d.......(.....
K..N..*Q
14:46:06.252905 IP localhost.56073 > localhost.57371: Flags [P.], seq 1670:1754, ack 958, win 6364, options [nop,nop,TS val 3601934988 ecr 1270361678], length 84
E.....@.@............	...d..,	.......|.....
..*.K..N4e
data: {"content":" inheritance","multimodal":false,"slot_id":0,"stop":false}



14:46:06.252931 IP localhost.56073 > localhost.57371: Flags [P.], seq 1670:1754, ack 958, win 6364, options [nop,nop,TS val 3601934988 ecr 1270361678], length 84
E.....@.@............	...d..,	.......|.....
..*.K..N4e
data: {"content":" inheritance","multimodal":false,"slot_id":0,"stop":false}



14:46:06.252988 IP localhost.57371 > localhost.56073: Flags [.], ack 1754, win 6352, options [nop,nop,TS val 1270361737 ecr 3601934988], length 0
E..4..@.@..............	,	...d.N.....(.....
K.....*.
14:46:06.253006 IP localhost.57371 > localhost.56073: Flags [.], ack 1754, win 6352, options [nop,nop,TS val 1270361737 ecr 3601934988], length 0
E..4..@.@..............	,	...d.N.....(.....
K.....*.
14:46:06.308144 IP localhost.56073 > localhost.57371: Flags [P.], seq 1754:1832, ack 958, win 6364, options [nop,nop,TS val 3601935044 ecr 1270361737], length 78
E.....@.@............	...d.N,	.......v.....
..*.K...48
data: {"content":" where","multimodal":false,"slot_id":0,"stop":false}



14:46:06.308163 IP localhost.56073 > localhost.57371: Flags [P.], seq 1754:1832, ack 958, win 6364, options [nop,nop,TS val 3601935044 ecr 1270361737], length 78
E.....@.@............	...d.N,	.......v.....
..*.K...48
data: {"content":" where","multimodal":false,"slot_id":0,"stop":false}



14:46:06.308203 IP localhost.57371 > localhost.56073: Flags [.], ack 1832, win 6351, options [nop,nop,TS val 1270361793 ecr 3601935044], length 0
E..4..@.@..............	,	...d.......(.....
K.....*.
14:46:06.308219 IP localhost.57371 > localhost.56073: Flags [.], ack 1832, win 6351, options [nop,nop,TS val 1270361793 ecr 3601935044], length 0
E..4..@.@..............	,	...d.......(.....
K.....*.
14:46:06.363536 IP localhost.56073 > localhost.57371: Flags [P.], seq 1832:1906, ack 958, win 6364, options [nop,nop,TS val 3601935099 ecr 1270361793], length 74
E..~..@.@............	...d..,	.......r.....
..*.K...44
data: {"content":" a","multimodal":false,"slot_id":0,"stop":false}



14:46:06.363557 IP localhost.56073 > localhost.57371: Flags [P.], seq 1832:1906, ack 958, win 6364, options [nop,nop,TS val 3601935099 ecr 1270361793], length 74
E..~..@.@............	...d..,	.......r.....
..*.K...44
data: {"content":" a","multimodal":false,"slot_id":0,"stop":false}



14:46:06.363598 IP localhost.57371 > localhost.56073: Flags [.], ack 1906, win 6349, options [nop,nop,TS val 1270361848 ecr 3601935099], length 0
E..4..@.@..............	,	...d.......(.....
K.....*.
14:46:06.363614 IP localhost.57371 > localhost.56073: Flags [.], ack 1906, win 6349, options [nop,nop,TS val 1270361848 ecr 3601935099], length 0
E..4..@.@..............	,	...d.......(.....
K.....*.
14:46:06.419460 IP localhost.56073 > localhost.57371: Flags [P.], seq 1906:1987, ack 958, win 6364, options [nop,nop,TS val 3601935155 ecr 1270361848], length 81
E.....@.@............	...d..,	.......y.....
..+3K...4b
data: {"content":" subclass","multimodal":false,"slot_id":0,"stop":false}



14:46:06.419476 IP localhost.56073 > localhost.57371: Flags [P.], seq 1906:1987, ack 958, win 6364, options [nop,nop,TS val 3601935155 ecr 1270361848], length 81
E.....@.@............	...d..,	.......y.....
..+3K...4b
data: {"content":" subclass","multimodal":false,"slot_id":0,"stop":false}



14:46:06.419511 IP localhost.57371 > localhost.56073: Flags [.], ack 1987, win 6348, options [nop,nop,TS val 1270361904 ecr 3601935155], length 0
E..4..@.@..............	,	...d.7.....(.....
K./0..+3
14:46:06.419522 IP localhost.57371 > localhost.56073: Flags [.], ack 1987, win 6348, options [nop,nop,TS val 1270361904 ecr 3601935155], length 0
E..4..@.@..............	,	...d.7.....(.....
K./0..+3
14:46:06.474703 IP localhost.56073 > localhost.57371: Flags [P.], seq 1987:2061, ack 958, win 6364, options [nop,nop,TS val 3601935210 ecr 1270361904], length 74
E..~..@.@............	...d.7,	.......r.....
..+jK./044
data: {"content":" (","multimodal":false,"slot_id":0,"stop":false}



14:46:06.474725 IP localhost.56073 > localhost.57371: Flags [P.], seq 1987:2061, ack 958, win 6364, options [nop,nop,TS val 3601935210 ecr 1270361904], length 74
E..~..@.@............	...d.7,	.......r.....
..+jK./044
data: {"content":" (","multimodal":false,"slot_id":0,"stop":false}



14:46:06.474766 IP localhost.57371 > localhost.56073: Flags [.], ack 2061, win 6347, options [nop,nop,TS val 1270361959 ecr 3601935210], length 0
E..4..@.@..............	,	...d.......(.....
K./g..+j
14:46:06.474783 IP localhost.57371 > localhost.56073: Flags [.], ack 2061, win 6347, options [nop,nop,TS val 1270361959 ecr 3601935210], length 0
E..4..@.@..............	,	...d.......(.....
K./g..+j
14:46:06.530810 IP localhost.56073 > localhost.57371: Flags [P.], seq 2061:2136, ack 958, win 6364, options [nop,nop,TS val 3601935266 ecr 1270361959], length 75
E.....@.@............	...d..,	.......s.....
..+.K./g45
data: {"content":"the","multimodal":false,"slot_id":0,"stop":false}



14:46:06.530835 IP localhost.56073 > localhost.57371: Flags [P.], seq 2061:2136, ack 958, win 6364, options [nop,nop,TS val 3601935266 ecr 1270361959], length 75
E.....@.@............	...d..,	.......s.....
..+.K./g45
data: {"content":"the","multimodal":false,"slot_id":0,"stop":false}



14:46:06.530876 IP localhost.57371 > localhost.56073: Flags [.], ack 2136, win 6346, options [nop,nop,TS val 1270362015 ecr 3601935266], length 0
E..4..@.@..............	,	...d.......(.....
K./...+.
14:46:06.530892 IP localhost.57371 > localhost.56073: Flags [.], ack 2136, win 6346, options [nop,nop,TS val 1270362015 ecr 3601935266], length 0
E..4..@.@..............	,	...d.......(.....
K./...+.
14:46:06.587099 IP localhost.56073 > localhost.57371: Flags [P.], seq 2136:2216, ack 958, win 6364, options [nop,nop,TS val 3601935323 ecr 1270362015], length 80
E.....@.@............	...d..,	.......x.....
..+.K./.4a
data: {"content":" derived","multimodal":false,"slot_id":0,"stop":false}



14:46:06.587124 IP localhost.56073 > localhost.57371: Flags [P.], seq 2136:2216, ack 958, win 6364, options [nop,nop,TS val 3601935323 ecr 1270362015], length 80
E.....@.@............	...d..,	.......x.....
..+.K./.4a
data: {"content":" derived","multimodal":false,"slot_id":0,"stop":false}



14:46:06.587181 IP localhost.57371 > localhost.56073: Flags [.], ack 2216, win 6345, options [nop,nop,TS val 1270362072 ecr 3601935323], length 0
E..4..@.@..............	,	...d.......(.....
K./...+.
14:46:06.587196 IP localhost.57371 > localhost.56073: Flags [.], ack 2216, win 6345, options [nop,nop,TS val 1270362072 ecr 3601935323], length 0
E..4..@.@..............	,	...d.......(.....
K./...+.
14:46:06.660540 IP localhost.56073 > localhost.57371: Flags [P.], seq 2216:2294, ack 958, win 6364, options [nop,nop,TS val 3601935396 ecr 1270362072], length 78
E.....@.@............	...d..,	.......v.....
..,$K./.48
data: {"content":" class","multimodal":false,"slot_id":0,"stop":false}



14:46:06.660553 IP localhost.56073 > localhost.57371: Flags [P.], seq 2216:2294, ack 958, win 6364, options [nop,nop,TS val 3601935396 ecr 1270362072], length 78
E.....@.@............	...d..,	.......v.....
..,$K./.48
data: {"content":" class","multimodal":false,"slot_id":0,"stop":false}



14:46:06.660586 IP localhost.57371 > localhost.56073: Flags [.], ack 2294, win 6343, options [nop,nop,TS val 1270362145 ecr 3601935396], length 0
E..4..@.@..............	,	...d.j.....(.....
K.0!..,$
